{
  "schema": "lobster-buffet.provider-operation-manifest.v0.1.0",
  "package": {
    "name": "lobster-buffet",
    "provider_api": "lobster-buffet.provider.v0",
    "version": "0.1.0",
    "stability": "draft",
    "public_release_ready": false
  },
  "portage": {
    "managed_paths": [
      "docs/operations/INITIAL_SCHEMA_SLICE.md",
      "schemas/operations/",
      "schemas/provider-operation-manifest.v0.1.0.json",
      "manifests/provider-operations.v0.1.0.json",
      "fixtures/operations/",
      "scripts/check_initial_operation_schemas.py"
    ],
    "local_only_paths": [],
    "doctor_checks": [
      "provider_manifest_schema_valid",
      "operation_schema_files_exist",
      "operation_fixture_validation_passes",
      "operation_definition_refs_resolve",
      "operation_side_effects_declared",
      "adapter_capabilities_declared"
    ]
  },
  "operations": [
    {
      "name": "command.list",
      "version": "0.1.0",
      "stability": "draft",
      "definition_ref": "docs/operations/OPERATION_CATALOG.md#command",
      "read_only": true,
      "input_schema_ref": "schemas/operations/command.list.input.v0.1.0.json",
      "output_schema_ref": "schemas/operations/command.list.output.v0.1.0.json",
      "side_effects": [
        "none"
      ],
      "approval": {
        "required": false,
        "classes": []
      },
      "adapter_capabilities": [],
      "errors": [
        "operation.version_unsupported"
      ],
      "portage": {
        "package_manifest_required": true,
        "doctor_checks": [
          "input_schema_exists",
          "output_schema_exists",
          "fixture_validates",
          "operation_is_read_only"
        ]
      },
      "redshield": {
        "operation_plan_required": true,
        "audit_event_required": false
      }
    },
    {
      "name": "command.describe",
      "version": "0.1.0",
      "stability": "draft",
      "definition_ref": "docs/operations/INITIAL_SCHEMA_SLICE.md#commanddescribename",
      "read_only": true,
      "input_schema_ref": "schemas/operations/command.describe.input.v0.1.0.json",
      "output_schema_ref": "schemas/operations/command.describe.output.v0.1.0.json",
      "side_effects": [
        "none"
      ],
      "approval": {
        "required": false,
        "classes": []
      },
      "adapter_capabilities": [],
      "errors": [
        "input.invalid",
        "catalog.command_not_found",
        "operation.version_unsupported"
      ],
      "portage": {
        "package_manifest_required": true,
        "doctor_checks": [
          "input_schema_exists",
          "output_schema_exists",
          "fixture_validates",
          "operation_is_read_only"
        ]
      },
      "redshield": {
        "operation_plan_required": true,
        "audit_event_required": false
      }
    },
    {
      "name": "git.workflow.inspect",
      "version": "0.1.0",
      "stability": "draft",
      "definition_ref": "docs/operations/OPERATION_CATALOG.md#git-workflow",
      "read_only": true,
      "input_schema_ref": "schemas/operations/git.workflow.inspect.input.v0.1.0.json",
      "output_schema_ref": "schemas/operations/git.workflow.inspect.output.v0.1.0.json",
      "side_effects": [
        "git.read"
      ],
      "approval": {
        "required": false,
        "classes": []
      },
      "adapter_capabilities": [
        "git.inspect_status"
      ],
      "errors": [
        "input.invalid",
        "project.not_git_repo",
        "adapter.capability_missing"
      ],
      "portage": {
        "package_manifest_required": true,
        "doctor_checks": [
          "input_schema_exists",
          "output_schema_exists",
          "fixture_validates",
          "operation_is_read_only",
          "adapter_capabilities_declared"
        ]
      },
      "redshield": {
        "operation_plan_required": true,
        "audit_event_required": false
      }
    },
    {
      "name": "git.workflow.guard",
      "version": "0.1.0",
      "stability": "draft",
      "definition_ref": "docs/operations/OPERATION_CATALOG.md#git-workflow",
      "read_only": true,
      "input_schema_ref": "schemas/operations/git.workflow.guard.input.v0.1.0.json",
      "output_schema_ref": "schemas/operations/git.workflow.guard.output.v0.1.0.json",
      "side_effects": [
        "git.read"
      ],
      "approval": {
        "required": false,
        "classes": []
      },
      "adapter_capabilities": [
        "git.inspect_status"
      ],
      "errors": [
        "input.invalid",
        "project.not_git_repo",
        "git.guard_failed",
        "adapter.capability_missing"
      ],
      "portage": {
        "package_manifest_required": true,
        "doctor_checks": [
          "input_schema_exists",
          "output_schema_exists",
          "fixture_validates",
          "operation_is_read_only",
          "adapter_capabilities_declared"
        ]
      },
      "redshield": {
        "operation_plan_required": true,
        "audit_event_required": false
      }
    },
    {
      "name": "alignment.scan",
      "version": "0.1.0",
      "stability": "draft",
      "definition_ref": "docs/operations/OPERATION_CATALOG.md#alignment",
      "read_only": true,
      "input_schema_ref": "schemas/operations/alignment.scan.input.v0.1.0.json",
      "output_schema_ref": "schemas/operations/alignment.scan.output.v0.1.0.json",
      "side_effects": [
        "filesystem.read",
        "git.read"
      ],
      "approval": {
        "required": false,
        "classes": []
      },
      "adapter_capabilities": [
        "project.resolve",
        "filesystem.read_project_metadata",
        "git.inspect_status"
      ],
      "errors": [
        "input.invalid",
        "project.not_found",
        "adapter.capability_missing"
      ],
      "portage": {
        "package_manifest_required": true,
        "doctor_checks": [
          "input_schema_exists",
          "output_schema_exists",
          "fixture_validates",
          "operation_is_read_only",
          "adapter_capabilities_declared"
        ]
      },
      "redshield": {
        "operation_plan_required": true,
        "audit_event_required": false
      }
    },
    {
      "name": "incident.list",
      "version": "0.1.0",
      "stability": "draft",
      "definition_ref": "docs/operations/OPERATION_CATALOG.md#incident",
      "read_only": true,
      "input_schema_ref": "schemas/operations/incident.list.input.v0.1.0.json",
      "output_schema_ref": "schemas/operations/incident.list.output.v0.1.0.json",
      "side_effects": [
        "filesystem.read"
      ],
      "approval": {
        "required": false,
        "classes": []
      },
      "adapter_capabilities": [
        "incident.read_state"
      ],
      "errors": [
        "input.invalid",
        "adapter.capability_missing",
        "incident.store_unavailable"
      ],
      "portage": {
        "package_manifest_required": true,
        "doctor_checks": [
          "input_schema_exists",
          "output_schema_exists",
          "fixture_validates",
          "operation_is_read_only",
          "adapter_capabilities_declared"
        ]
      },
      "redshield": {
        "operation_plan_required": true,
        "audit_event_required": false
      }
    },
    {
      "name": "incident.update",
      "version": "0.1.0",
      "stability": "draft",
      "definition_ref": "docs/operations/OPERATION_CATALOG.md#incident",
      "read_only": false,
      "input_schema_ref": "schemas/operations/incident.update.input.v0.1.0.json",
      "output_schema_ref": "schemas/operations/incident.update.output.v0.1.0.json",
      "side_effects": [
        "filesystem.write"
      ],
      "approval": {
        "required": true,
        "classes": []
      },
      "adapter_capabilities": [
        "incident.read_state",
        "incident.write_state"
      ],
      "errors": [
        "input.invalid",
        "incident.not_found",
        "incident.state_conflict",
        "adapter.capability_missing",
        "approval.required"
      ],
      "portage": {
        "package_manifest_required": true,
        "doctor_checks": [
          "input_schema_exists",
          "output_schema_exists",
          "fixture_validates",
          "approval_required",
          "adapter_capabilities_declared"
        ]
      },
      "redshield": {
        "operation_plan_required": true,
        "audit_event_required": true
      }
    },
    {
      "name": "incident.close",
      "version": "0.1.0",
      "stability": "draft",
      "definition_ref": "docs/operations/OPERATION_CATALOG.md#incident",
      "read_only": false,
      "input_schema_ref": "schemas/operations/incident.close.input.v0.1.0.json",
      "output_schema_ref": "schemas/operations/incident.close.output.v0.1.0.json",
      "side_effects": [
        "filesystem.write"
      ],
      "approval": {
        "required": true,
        "classes": []
      },
      "adapter_capabilities": [
        "incident.read_state",
        "incident.write_state"
      ],
      "errors": [
        "input.invalid",
        "incident.not_found",
        "incident.close_blocked",
        "incident.state_conflict",
        "adapter.capability_missing",
        "approval.required"
      ],
      "portage": {
        "package_manifest_required": true,
        "doctor_checks": [
          "input_schema_exists",
          "output_schema_exists",
          "fixture_validates",
          "approval_required",
          "adapter_capabilities_declared"
        ]
      },
      "redshield": {
        "operation_plan_required": true,
        "audit_event_required": true
      }
    },
    {
      "name": "review.list",
      "version": "0.1.0",
      "stability": "draft",
      "definition_ref": "docs/operations/OPERATION_CATALOG.md#review",
      "read_only": true,
      "input_schema_ref": "schemas/operations/review.list.input.v0.1.0.json",